{
  "$schema": "../../schemas/dataset.schema.json",
  "schemaVersion": "1.0.0",
  "generatedAt": "2026-08-29T00:00:00Z",
  "minimumContributionSize": 20,
  "records": [
    {
      "shortcut": "ctrl-f",
      "intent": "search",
      "capability": "lack-of-data",
      "recommendation": "acceptable",
      "browsers": ["Chrome", "Edge", "Firefox", "Safari", "Brave", "Opera", "Vivaldi"],
      "operatingSystems": ["Windows", "macOS", "Linux"],
      "layouts": ["us", "swedish", "german", "uk"],
      "evidence": "none",
      "note": "Potential browser Find conflict. Awaiting versioned, reproducible observations."
    },
    {
      "shortcut": "ctrl-z",
      "intent": "undo",
      "capability": "lack-of-data",
      "recommendation": "recommended",
      "browsers": ["Chrome", "Edge", "Firefox", "Safari", "Brave", "Opera", "Vivaldi"],
      "operatingSystems": ["Windows", "macOS", "Linux"],
      "layouts": ["us", "swedish", "german", "uk"],
      "evidence": "none",
      "note": "Undo is a de facto convention. Capability still requires direct observation."
    },
    {
      "shortcut": "ctrl-s",
      "intent": "save",
      "capability": "lack-of-data",
      "recommendation": "recommended",
      "browsers": ["Chrome", "Edge", "Firefox", "Safari", "Brave", "Opera", "Vivaldi"],
      "operatingSystems": ["Windows", "macOS", "Linux"],
      "layouts": ["us", "swedish", "german", "uk"],
      "evidence": "none",
      "note": "Save is a de facto convention, with a potential browser Save Page conflict."
    },
    {
      "shortcut": "ctrl-l",
      "intent": "list",
      "capability": "lack-of-data",
      "recommendation": "acceptable",
      "browsers": ["Chrome", "Edge", "Firefox", "Safari", "Brave", "Opera", "Vivaldi"],
      "operatingSystems": ["Windows", "macOS", "Linux"],
      "layouts": ["us", "swedish", "german", "uk"],
      "evidence": "none",
      "note": "List is understandable in context, but the address-bar conflict must be verified."
    }
  ]
}
